{
  "schema": 1,
  "note": "The on-screen control hints shown during play (docs/ui/hud-spec.md section 22) and the YOU labels. One scheme per control layout, named by the layout's id in data/input/layouts.json (kb-solo, kb-shared-p1, kb-shared-p2, arena, brawler, simple-pad); the HUD picks the scheme from the player's device and preset and falls back to 'today'. A row is an action (or a group) and a short word; the glyph drawn is the active layout's own binding for that action (the keys or buttons Controls wrote in layouts.json), so a remap shows the player's own controls. A row for an action the layout does not bind is skipped. A row with only_when_avail shows only while the fighter can use that action (Transform, while a form is ready). The touch layout has no legend: its buttons are on screen. intro_seconds: how long the hints show at the start of every match (the last two seconds fade) unless prompts are on or the control_hints option is always.",
  "you": { "single": "YOU", "pair": ["P1", "P2"] },
  "intro_seconds": 12,
  "schemes": {
    "today": {
      "rows": [
        { "action": "move", "label": "Fly" },
        { "action": "light", "label": "Light" },
        { "action": "heavy", "label": "Heavy" },
        { "action": "signature", "label": "Signature" },
        { "action": "guard", "label": "Guard (hold)" },
        { "action": "dodge", "label": "Dodge, sprint" },
        { "action": "power", "label": "Power (hold)" },
        { "action": "mode", "label": "Energy (hold)" },
        { "action": "context", "label": "Context" },
        { "actions": ["power", "special1", "special2", "special3"], "label": "Specials" },
        { "action": "escape", "label": "Escape" },
        { "action": "transform", "label": "Transform", "only_when_avail": true }
      ]
    },
    "kb-solo": {
      "rows": [
        { "action": "move", "label": "Fly" },
        { "action": "light", "label": "Light" },
        { "action": "heavy", "label": "Heavy" },
        { "action": "signature", "label": "Signature" },
        { "action": "guard", "label": "Guard (hold)" },
        { "action": "dodge", "label": "Dodge, sprint" },
        { "action": "power", "label": "Power (hold)" },
        { "action": "mode", "label": "Energy (hold)" },
        { "action": "context", "label": "Context" },
        { "actions": ["power", "special1", "special2", "special3"], "label": "Specials" },
        { "action": "escape", "label": "Escape" },
        { "action": "transform", "label": "Transform", "only_when_avail": true }
      ]
    },
    "kb-shared-p1": {
      "rows": [
        { "action": "move", "label": "Fly" },
        { "action": "light", "label": "Light" },
        { "action": "heavy", "label": "Heavy" },
        { "action": "signature", "label": "Signature" },
        { "action": "guard", "label": "Guard (hold)" },
        { "action": "dodge", "label": "Dodge, sprint" },
        { "action": "power", "label": "Power (hold)" },
        { "action": "mode", "label": "Energy (hold)" },
        { "action": "context", "label": "Context" },
        { "actions": ["power", "special1", "special2", "special3"], "label": "Specials" },
        { "action": "escape", "label": "Escape" },
        { "action": "transform", "label": "Transform", "only_when_avail": true }
      ]
    },
    "kb-shared-p2": {
      "rows": [
        { "action": "move", "label": "Fly" },
        { "action": "light", "label": "Light" },
        { "action": "heavy", "label": "Heavy" },
        { "action": "signature", "label": "Signature" },
        { "action": "guard", "label": "Guard (hold)" },
        { "action": "dodge", "label": "Dodge, sprint" },
        { "action": "power", "label": "Power (hold)" },
        { "action": "mode", "label": "Energy (hold)" },
        { "action": "context", "label": "Context" },
        { "actions": ["power", "special1", "special2", "special3"], "label": "Specials" },
        { "action": "escape", "label": "Escape" },
        { "action": "transform", "label": "Transform", "only_when_avail": true }
      ]
    },
    "arena": {
      "rows": [
        { "action": "move", "label": "Fly" },
        { "action": "light", "label": "Light" },
        { "action": "heavy", "label": "Heavy" },
        { "action": "signature", "label": "Signature" },
        { "action": "guard", "label": "Guard (hold)" },
        { "action": "dodge", "label": "Dodge, sprint" },
        { "action": "power", "label": "Power (hold)" },
        { "action": "mode", "label": "Energy (hold)" },
        { "action": "context", "label": "Context" },
        { "actions": ["power", "special1", "special2", "special3"], "label": "Specials" },
        { "action": "escape", "label": "Escape" },
        { "action": "transform", "label": "Transform", "only_when_avail": true }
      ]
    },
    "brawler": {
      "rows": [
        { "action": "move", "label": "Fly" },
        { "action": "light", "label": "Light" },
        { "action": "heavy", "label": "Heavy" },
        { "action": "signature", "label": "Signature" },
        { "action": "guard", "label": "Guard (hold)" },
        { "action": "dodge", "label": "Dodge, sprint" },
        { "action": "power", "label": "Power (hold)" },
        { "action": "mode", "label": "Energy (hold)" },
        { "action": "context", "label": "Context" },
        { "actions": ["power", "special1", "special2", "special3"], "label": "Specials" },
        { "action": "escape", "label": "Escape" },
        { "action": "transform", "label": "Transform", "only_when_avail": true }
      ]
    },
    "simple-pad": {
      "rows": [
        { "action": "move", "label": "Fly" },
        { "action": "light", "label": "Light (hold: heavy)" },
        { "action": "signature", "label": "Signature" },
        { "action": "guard", "label": "Guard (hold)" },
        { "action": "dodge", "label": "Dodge, sprint" },
        { "action": "power", "label": "Power (hold)" },
        { "action": "context", "label": "Context" },
        { "action": "escape", "label": "Escape" },
        { "action": "transform", "label": "Transform", "only_when_avail": true }
      ]
    }
  }
}
